,sentence
0,"Are you sure I will not get into trouble, Bill"
1,Don't be a wuwuwuss
2,I'd come with you if I weren't (coughing) dying
3,You're not dying
4,you didn't see the vvvomit coming out of my nose this morning
5,That's disgusting
6,"Ok, go get the wax"
7,In the cellar
8,"You want to flflfloat, dont' you"
9,(whining) Fine
10,(feedback from walkietalkie) Hurry up
11,"ok, don't worry"
12,Where is the wax
13,There it is
14,Yes.
15,What was that What is that
16,Heavens.
17,alright
18,"shshshe's all ready, captain"
19,she
20,"you always call a bboat, she"
21,she
22,"Thanks, Billy."
23,See you later. Bye.
24,Be careful.
25,No
26,No
27,Bill's gonna kill me
28,Hiya Georgie
29,what a nice boat
30,do you want it back
31,Yes please.
32,You look like a nice boy. I bet you have a lot of friends.
33,"Three, but my brother is the bestest"
34,Where's he
35,"Home, sick"
36,I bet I could cheer him up. I'll give him a balloon.
37,do you want a balloon too Georgie
38,I'm not supposed to take stuff from strangers
39,"oh well, I'm Pennywise the dancing clown"
40,Pennywise yes meet Georgie
41,Georgie meet Pennywise
42,"Now we are not strangers, are we"
43,what are you doing in the sewer
44,A storm blew me away
45,Blew the whole circus away
46,"Can you smell the circus, Georgie"
47,"There are peanuts, cotton candy "
48,hot dogs 
49,annnnnnd
50,Popcorn
51,Popcorn Is that your favorite
52,Uh huh. Mine too
53,"Because they pop. Pop, pop, pop."
54,"Pop, pop, pop"
55,Pop
56,I should get going now.
57,Without your boat
58,You don't want to lose it Georgie
59,Bill's gonna kill you
60,Here
61,Take it.
62,"Take it, Georgie"
63,Help
64,Billy
65,"Pull it, Mike."
66,"Go on now, pull it"
67,"Here, reload it"
68,"You need to start takin' more responsibility around here, Mike"
69,Your dad was younger than you when 
70,"I'm not my dad, okay"
71,Yeah
72,"Look at me, son."
73,Look at me
74,There are two places you can be in this world.
75,You can be here like us or you can be there 
76,like them.
77,If you waste your time hemming and hawing
78,somebody else will make that choice for you
79,Except that you will not know until you feel that bolt between your eyes.
80,There is a church full of Jews.
81,And Stan has to take the super Jewy test
82,But how does it work
83,They slice the tip of his dick off
84,But then you'll have nothing left
85," It is true.  Wait, you guys"
86,"Hey, Stan, what happens at the bar mitzvah anyways"
87,Ed says you slice the tip of the ddddick off
88,"Yes, Rabbi's gonna pull down your pants"
89,"and he will tell the crowd: ""Where's the beef""."
90,"At he bar mitzvah, I read from the Torah "
91,"and then I make a speech, and suddenly I become a man"
92,There's more funner ways to become a man.
93,"""More fun ways"", you mean."
94,Fuck.
95,Do you think they'll sign my yearbook
96,"""Dear Richie "
97,"sorry for taking a hot, steaming dump in your backpack last month"
98,"""Have a good summer""."
99,"Are you in there by yourself, Beaverly"
100,"Or do you have half the guys in the school with you, huh slut"
101,"I know you're in there, you little shit, I can smell you."
102,No wonder you don't have any friends.
103,"Which is it, Greta Am I a slut or a little shit"
104,Make up your mind
105,You're trash.
106,We just wanted to remind you.
107,Such a loser.
108,At least now you'll smell better.
109,Gross.
110,Let's go girls.
111,"Have a nice summer, Beaverly"
112,Pathetic.
113,The best feeling ever
114,Yes
115,Try tickling your pickle for the first time
116,What do you guys wanna do tomorrow
117,I start my training.
118, What training  Street Fighter.
119,"Is that how you want to spend your summer, stuck in an arcade"
120,Better than inside your mother.
121,What if we go the the quarry
122,"Guys, we can ggo to the barrens"
123,Right
124,Betty Ripsom's mom
125,Does she really expect to see her coming out of the school
126,I don't know
127,As if Betty Ripsom's been hiding in HomeEc for the last few weeks
128,Do you think they'll actually find her
129,Sure
130,"In a ditch. All decomposed, covered in worms and maggots, smelling "
131,like Eddie's mom's underwear.
132,Shut up Gross.
133,She's not dead. She mmmmissing.
134,"Sorry Bill, she's missing"
135,You know the barrens aren't that bad
136,Who doesn't love splashing around in shitty water
137,"Nice frisbee, flamer"
138,Give it back
139,Fuckin' losers
140,Loser.
141,"You ssssuck, Bowers"
142,"Shut up, Bill."
143,"Did you ssssay something, BbbbBilly"
144,You got a free ride this year cuz of your little brother
145,"Ride's over, Denbrough."
146,"This summer will be a hurttrain, for you and your faggot friends."
147,I wish he'd go missing.
148,He's probably the one doing it.
149,Will you let me go by
150,or is there a secret password or something
151, Sorry.  Sorry is not 
152,password.
153,Henry and his goons are over by the west entrance.
154,So you should be fine.
155,I wasn't
156,Everyone knows he's looking for you.
157,Whatchu listening to
158,New Kids on the Block.
159,"I don't even like them, I was just"
160,"Wait. You're the new kid, right Now I get it."
161,There's nothing to get.
162,I'm just messing with you
163,I'm Beverly Marsh.
164,Yes. I know that because we're in the same class.
165,Social Studies. And you were 
166,I'm Ben. But almost everyone calls me 
167,The new kid.
168,"Well, Ben, there are worse things to be called"
169,Let me sign this.
170,"Stay cool, Ben from Soc class"
171,Yeah
172,"You too, Beverly."
173,"Hang tough, new kid on the block."
174,"""Please don't go girl"""
175,That's the name of another New Kids on the Block song
176,He thrusts his fists  against the post
177,He thrusts his fists against the
178,shit. pppost
179,Need some help
180,I thought we agreed.
181, Before you say anything   Bill.
182,Let me show you something first.
183,The barrens
184,It is the only place where Georgie could have ended
185,"He's gone, Bill"
186,"But if the storm swept Georgie in, we should have gone "
187,"HE'S GONE, HE'S DEAD"
188,He's dead There is nothing we can do Nothing
189,Now take this down before your mother sees it.
190,Next time you want to take something from my office
191,ask
192,I guess you get your tunnels back.
193,Come in.
194,"Oh, Jesus."
195,Mike
196,"Hurry up, son"
197,Help I'm burning
198,Mike
199,Stay the fuck out of my town
200,Mike
201,"Are you okay, son"
202,"You're not studying, Stanley."
203,"How's it gonna look,"
204,the rabbi's son can't finish his own Torah reading.
205,"Take the book to my office,"
206,Obviously you're not using it.
207,"Take everything but the delicious deals, guys."
208,My mom loves them.
209,"Hey, first you said the barrens and now you're saying the sewer"
210,"I mean, if we get caught"
211,"We won't, Eds. The sewers are public works."
212,"We are the public, aren't we"
213,"Eddie, are these your birth control pills"
214,"Yes, I'm saving it for your sister. This is private stuff."
215,"Hello, welcome to The Children's Hour Derry."
216,"Eddie, dear, where you boys off to in such a rush"
217,"Our word of the day is ""clown"". They know what it means"
218,"Uhm, just mmmy backyard, Mrs. K"
219,I got a new
220,A new croquet set. Jeez spit it out blubber Bill
221,Okay
222,"Oh and sweetie, don't go rolling around in the grass"
223,especially if it's just been cut
224,you know how bad your allergies can get.
225,Yes mom. Come on.
226,Aren't you forgetting something
227,Water surrounds us. Even it is upon us.
228,They do not believe me
229,Try it at home.
230,When outside 
231,"Do you want one from me too, Mrs. K"
232,No.
233,Sorry mom.
234,"""Your hair is winter fire, January embers "
235,"""My heart burns there too."""
236,Slower
237,Hiyo Silver awaaay
238,Let's move on
239,Your old lady bike's too fast for us.
240,I found it.
241,Isn't it summer vacation
242,I'd think you'd be ready to take a break from the books.
243,I like it in here.
244,A boy should be spending his summer outside with his friends.
245,Don't you have any friends
246,Can I have the book now
247,Egg boy
248,What on Earth are you doing
249,"Where you off to, Tits"
250,Got ya
251,Wait.
252, Hold him.  Leave me alone
253, Hit him. you will not escape.
254,Help
255,Hold him
256,"Hold him, Hockstetter. Grab him, Belch."
257, Leave me alone.  Look all that blubber.
258,I'm gonna light his hair like Michael Jackson
259,Hold him
260,"Get off me, get off me"
261,Help
262,Help
263,"Okay, new kid."
264,This is why us locals call this the kissing bridge
265,It's for two things: sucking face
266,and cutting names.
267,"Henry, please."
268,Stop Henry
269,Shut up
270,I'm gonna carve my whole name into his cottage cheese
271,I'm gonna cut your fucking tits off. I swear to god
272,Get him
273,Come on
274,Get him
275,You can't run
276, No.  We must find the fatso.
277,My knife. My old man will kill me
278,". You two, get him  Come on"
279,Move your fucking ass
280,Go that way
281,He's down there.
282,I don't know. I guess.
283,That's poison ivy. And that's poison ivy.
284,And that's poison ivy.
285,Where Where's the poison ivy
286,"No where, not every fucking plant is poison ivy, Stanley."
287,Ok well I'm starting to get itchy now and I'm pretty sure this is not good for me
288,Do you use the same bathroom as your mother
289,"Sometimes, yeah."
290,Then you probably have crabs.
291,That's not funny.
292,Aren't you guys coming in
293,Uhuh that's gray water.
294,What the hell is gray water
295,It's basically piss and shit. So I'm just telling you
296,You guys are splashing around in millions of gallons of Derry pee.
297,"Are, are you serious"
298,"Doesn't smell like caca to me, Senor"
299,Oookay I can smell it from here.
300,It's probably just your breath wafting back into your face
301,Have you ever heard of a staph infection
302,"I'll show you a ""staff"" infection."
303,That's so unsanitary. These
304,you guys are like swimming in a toilet bowl right now
305,Have you ever heard of listeria
306,Are you retarded
307,You're the reason we're in this situation
308,Guys
309,Shit. Don't tell me that's 
310,No.
311,Georgie was wearing galoshes.
312,Who's sneaker is it
313,It's Betty Ripsoms.
314,Shit
315,"Shit, oh god, oh fuck"
316,I don't like this
317,"How do you think Betty feels,"
318,going around these tunnels with only one fucking shoe.
319,What if she's still here
320,"Eddie, come on"
321,My mom will have an aneurysm if she finds out we were playing down here.
322,I'm serious.
323,Bill
324,"If I were Betty Ripsom, I would want us to find me."
325,Georgie too.
326,What if I don't want to find them
327,"I mean, no offense, Bill, but I do not want to end up like "
328,I don't want to go missing either
329, You're right.  You too
330,"It's summer,"
331,we're supposed to be having fun.
332,This isn't funny.
333,This is scary and disgusting
334,"Holy shit, what happened to you"
335,"I hear you, tits."
336,Don't think you can stay down here all damn day
337,"(whispering) You found us, Patrick."
338,"You found us, Patrick"
339,Patrick.
340,Shit.
341,I think it's great that we're helping the new kid
342,but we also need to think about our own safety.
343,"I mean, he's bleeding all over"
344,and you guys know there's an AIDS epidemic happening right now as we speak
345,I mean my mom's friend in New York City got it just by touching a dirty pole in the subway
346,"and she got AIDS blood into her system through a hangnail, a hangnail"
347,And they can amputate legs and arms.
348,But how do you amputate waist
349,"You know that there are alleys full of AIDS infected needles, right"
350,You. Know that.
351,We're dead.
352,"Richie, wait here. Come on."
353,Glad I got to meet you before you died.
354,Good.
355,Can we afford that
356,It's all we got.
357,You kidding me
358,"Wait, you have an account here don't you"
359,If my mom finds out I bought all this stuff for myself
360,I'll spend the whole rest of the week in the emergency room.
361,"See you later, dad."
362,"See ya, Greta."
363,You okay
364,"I'm fine, what's wrong with you"
365,None of your business.
366,New kid outside looks like someone killed him.
367,We need some ssssupplies
368,but we don't have enough money.
369,"I like your glasses, Mr. Keene"
370,You look just like Clark Kent.
371,I don't know about that.
372,Can I try them on
373,Sure.
374,What do you think
375,"Well how about that,"
376,you look just like Lois Lane.
377,Really
378,"Well, here you go."
379,"Shoot, I'm so sorry. It's okay."
380,Just suck the wound.
381,I need to focus right now. You need to focus
382,"Yeah, can you go get me something"
383,"Jesus. Oh, what do you need"
384,"Go get my bifocals, they're in my second fanny pack."
385,Why do you have two fanny pack
386,"I need to focus right now, it's a long story."
387,I don't want to hear it.
388,"uhmm, thththanks."
389,Even Steven.
390,"Oh god, he's bleeding."
391,"Oh my god, Ben from Soc"
392,You have to suck the wound before you apply the bandage.
393, It's basic.  What are you talking about
394,"Are you okay, that looks like it hurts."
395,"No, I'm good. I just fell."
396,"Yeah, right into Henry Bowers."
397,"Shut it, RRRichie"
398,Why It's the truth.
399,"You sure they got ""The Right Stuff"" to fix you up"
400,You know wwwwwe'll take care of him.
401,"Thanks again, Beverly."
402,"Sure, maybe I'll see you around."
403,"Yeah, we were maybe thinking about going to the qqqquarry tomorrow,"
404,if you wanna
405,come
406,Good to Know. Thanks.
407,"Nice going, bringing up Bowers in front of her."
408,"Yeah, did you hear what she did"
409,What'd she do
410,"Well, from what"
411,I heard that the list is longer than my wang.
412,That's not saying much.
413,They're jjjust rumors.
414,"Anyway, Bill had her back in third grade."
415,They kissed in the school play.
416,The reviews said that you can't fake that kind of passion.
417,"Now, pip pip and tallyho my good fellows,"
418,I do believe this chap requires our utmost attention.
419,Now get in there Dr. K and fix him up
420,"Why don't you shut the fuck up, Einstein, because I know what I'm doing"
421,and I don't want you doing the British guy.
422,Suck the wound. Get in there.
423,toilet and tub water travels down drains into sewers.
424,Culverts are fun to play with all your friends.
425,Just keep the water into drains and sewers reach.
426,"When you are there with friends, you can have fun like a clown"
427,"That's right, it is the word of the day."
428,Hi daddy.
429,Hey Bevvie
430,What you got there
431,Just some things.
432,Like what
433,Tell me you're still my little girl.
434,Yes daddy.
435,Good.
436,A high ball to the left. His last batting.
437,He brushed the post.
438,"Wade Booggs, of course, leads the league in such long shots."
439,This is what you did. This is what
440,Do it
441,Oh my god
442, Piece of cake.  Poor tree.
443,So easy
444,"Oh my god, that was terrible. I win."
445,You won Yeah
446,"You see my loogie, it went the farthest."
447,It's about distance. It's mass.
448,What is mass
449,It doesn't matter how far it goes.
450,"It's how cool it looks, and it's green or it's white."
451,Alright.
452,Who's first
453,I'll go.
454,Sissies
455,What the fuck
456,"Ahhh, holy shit, we just got shown off by a girl."
457,We have to do that now
458,Yes.
459,Come on
460,Oh shit
461,I already won Already we won
462,They fell Yes
463,"Oh,shit Wwwwait, wait, wait."
464, Ah fuck What was that  It just touched my foot.
465,Does that work
466, Where  Here.
467,It's a turtle.
468,"News flash, Ben, School's out for summa"
469,"Oh that, that's not school stuff."
470, Who sent you this  No one.
471,No one.
472,What's with the history project
473,"Oh well, when I first moved here, I really didn't have anyone to hang out with"
474,so I just started spending time in the library.
475,You went to the library
476,On purpose
477,I wanna see.
478,What's the Black Spot
479,The Black Spot was a nightclub that was burned down years ago by
480,that racist cult.
481,The what
482,Don't you watch Geraldo
483,Yyyyyour hair
484,Your hair looks beautiful. Beverly.
485,"Oh, hey thanks."
486,"Here, pass."
487,Why's it all murders and missing kids
488,Derry's not like any town I've ever been in before
489,They did a study once 
490,it turns out people die or disappear six times the national average.
491,You read that
492,Not just grownups
493,Kids are like worse
494,"way, way worse."
495,"I've got more stuff, if you want to see it."
496,"Do not freak out, just tell us."
497,Yes. I heard he has a roller coaster and a chimpanzee 
498,and the bones of an old man. Yes.
499,Heavens.
500,"Woah, woah, woah, wow"
501,"Cool, huh"
502,"No, nothing cool."
503,There's nothing cool.
504,"Well this is cool, wait, no it's not."
505,What's that
506,That That's the charter for Derry Township
507,Nerd alert.
508,"Actually, it's really interesting."
509,Derry started as a beaver trapping camp.
510,"Still is, am I right, boys"
511,Ninetyone people signed the charter that made Derry.
512,"But later that winter, they all disappeared without a trace."
513,The entire camp
514,There were rumors of Indians
515,but no sign of an attack.
516,Everyone thought it was a plague or something.
517,But it's like 
518,one day everybody just woke up and left.
519,The only clue was a trail of clothes leading to the wellhouse.
520,"Jesus, we can go on ""Unsolved Mysteries"""
521, Let's do it. You are brilliant.  Maybe.
522,I don't know.
523,"Maybe he's  just trying to make friends, Stanley."
524,Where was the well house
525,"I don't know, somewhere in town, I guess."
526,Why
527,Nothing.
528,Nobody knows the trouble I've seen no one knows my pain
529,Eddie
530,What are you looking for
531,Fuck. My mom will kill me.
532,"Do you think this will help me, Eddie"
533,Help
534,"Where are you going, Eds"
535,"If you lived here, you'd be home right now."
536,"Come join the clown, Eds."
537,You'll float down here.
538,"We all float down here,"
539,yes we do.
540,"""Your hair is winter fire "
541,"""January embers"""
542,"""My heart burns there too."""
543,Beverly
544,Beverly.
545,Help me.
546,Please help me.
547,"We all want to meet you, Beverly."
548,All we float down here.
549,Hello Who you are
550, I'm Veronica.  Betty Rapsom.
551,Patrick Hockstetter.
552,Come closer.
553, You want to see  We float.
554,We changed.
555,Daddy
556,Help
557,Help
558,What the hell's goin' on
559,The sink
560,"There's blood, it's"
561,What blood
562,"The sink, you don't see it"
563,There was blood.
564,"You worry me, Bevvie."
565,You worry me a lot.
566,But you don't see
567,Why'd you do this to your hair
568,Makes you look like a boy.
569,"I lost it, Billy. Don't be mad."
570,I'm not mad at you.
571,Just floated off.
572,"But, Bill, if you come with me "
573,You'll float too.
574,Georgie.
575,You'll float too
576,You'll float too
577,You'll float too
578,You'll float too
579,You'll float too
580,You'll float too
581,You'll float too
582,You'll float too
583,You'll float too
584,We must not go down the alley.
585, It takes a lot down the alley.  No. is faster.
586,It is more dangerous and unpleasant.
587, What do you mean it's more dangerous  It smells of urine and is disgusting.
588,All right. Can you tell me exactly what she said
589,Just you guys need to hurry over.
590, Good.  Good.
591,You came.
592,II need to show you something.
593,What is it
594,More than we saw at the quarry
595,"Shut up Just shut up, Richie."
596,My dad will kill me if he finds out that I had boys in the apartment.
597,Wwwwwe'll leave a lookout.
598,"Now Richie, just stay here."
599,"Woah, woah, woah, what if her dad comes back"
600,Do what you always do. Start talking.
601,It is a gift.
602,In there
603,What is it
604,You'll see.
605,"Great, bringing us to the bathroom."
606,You know that 89% of the worse accidents
607,occur in the bathroom and kitchen
608,And that's where all the bacteria and fungi are 
609,and it is not a hygienic place 
610,I knew it
611,Do you see it
612,Yes.
613,What happened in here
614,"My dad couldn't see it, I thought that I might be crazy."
615,"Well if you're crazy, then we're all crazy."
616,We ccccan't leave it like this.
617,You never went to the Summer Fair Derry
618,"No, I think not."
619,That I know.
620,I go every year 
621,but once I went with Richie and I won because I hit the target.
622,But there were so many prizes I didn't know which one to choose.
623,"It's not true, you know"
624,What they say about me.
625,I was only ever kissed by one guy.
626,It was a long time ago.
627,But it was a nice kiss though.
628,"""January embers"""
629,Wwwwwas that in the play
630,"No, the poem."
631,"Oh, I really don't read much pppoetry."
632,"Oh I just,"
633,never mind.
634,"Oh, just so you know,"
635,I never believed any of the rumors.
636,None of us losers do.
637,We like hanging with you.
638,Thanks.
639,You should not thank us too much
640,hanging out with us makes you a loser too.
641,I can take that.
642,"No, I love being your personal doorman."
643,Really could you idiots have taken any longer
644," Shut up, Richie.  Yeah, shut up, Richie."
645,"Oh okay, trash the trashmouth, I get it."
646,Hey I wasn't the one scrubbing the bathroom floor
647,imagining that her sink went all Eddie's mom's vagina on halloween.
648,She didn't imagine.
649,I also saw something too.
650,"You saw blood, too"
651,"Not blood,"
652,I saw GgGeorgie.
653,"It seemed so real,"
654,I mean it seemed like him but there was this
655,A clown.
656,"Yeah, I saw him too."
657,"Wait, can only virgins see this stuff"
658,Is that why I'm not. seeing this shit
659,"Oh shit, that's Belch Huggins car."
660,"We, we should probably get outta here. yes"
661,Wait isn't that the home schooled kids bike
662,"Yeah, that's Mikes."
663,We have to help him.
664,We should
665,Yes.
666,Come on.
667,Take that
668," Take that, bitch  Damn fool"
669, Bitch  Motherfucker
670, Take that bitch
671,Damned
672,What are you going to do
673,Get up
674,Raise that ass
675,Fucking idiot
676,"Come on, Henry, do it harder"
677,Times.
678,Nice throw. Thanks.
679,You losers are trying too hard.
680,"She'll do you,"
681,You just gotta ask nicely
682,like I did.
683,The fuck
684,"Come on, get him"
685,ROCK WAR
686, Give them hard  Watch out
687,"Drop dead, you fuckers."
688,Eddie
689,Get out of here
690,Shit
691,(slowly) FUCK YOU BITCH
692,Come on guys  Harder
693,"Go to the hell, losers"
694,"GO BLOW YOUR DAD, YOU MULLETWEARING ASSHOLE"
695,"Thanks guys, but you shouldn't have done that,"
696,he'll be after you guys too now.
697,"Ah, now Bowers, he's always after us."
698,I guess that's one thththing we all have in common.
699,"Yes son, welcome to the loser's club."
700,Here.
701,They said they found part of his hand all chewed up near the standpipe.
702,He asked to borrow a pencil once.
703,It's like she's been fffforgotten
704,because Corcoran's missing.
705,Is it ever gonna end
706,"What the fuck, dude"
707,What are you guys talking about
708,What they always talk about.
709,"I actually think it will end,"
710,"for a little while, at least."
711,What do you mean
712,So I was going over all of my data research
713,and I charted out all of the big events
714,The Ironworks explosion in 1908
715,The Bradley Gang in '35
716,and The Black Spot in '62.
717,And now the kids being
718,I realized that this stuff seems to happen
719,(Bill and Ben) every 27 years.
720,Ok so let me get this straight
721,IT comes out from wherever to eat kids for like a year
722,and then what IT just goes into hibernation
723,Maybe it's like  What do you call it
724,Cicadas.
725,"You know, the bugs that come out once every 17 years."
726,My grandfather thinks this town is cursed
727,He says
728,that all the bad things that happened in this town
729,are because of one thing
730,An evil thing that feeds off the people of Derry.
731,But it can't be one thing.
732,We all saw something different.
733,Maybe
734,Or maybe IT knows what scares us most and that's what we see.
735,II saw a leper.
736,He was like a walking infection.
737,But you didn't
738,Because IT isn't real.
739,None of this is.
740,Not Eddie's leper
741,or Bill seeing Georgie
742,or the woman I keep seeing.
743,Is she hot
744,No. Richie.
745,She's not hot
746,Her face is all messed up.
747,None of this makes any sense.
748,They're all like bad dreams.
749,"I don't think so, I know the difference between a bad dream and real life, okay"
750,What did you see You saw something too
751,Yes.
752,You guys know that burnt down house on Harris Avenue
753,I was inside when it burned down
754,Before I rescued 
755,my mom and dad were trapped in the next room over from me.
756,They were pushing and pounding on the door
757,trying to get to me.
758,"Hurry up, son"
759,I'm burning
760,But it was too hot
761,When firefighters found them
762,the skin on their hands melted down to the bone.
763,We're all afraid of something.
764,got that right.
765,Why Rich What are you afraid of
766,Clowns.
767,Okay.
768,Look.
769,Storm drain
770,"That's were Georgie disappeared,"
771,"there's the Ironworks,"
772,and the Black Spot.
773,Everywhere IT happens it'sit's all connected by the sewers
774,and they all meet up at the
775,(Ben) the wellhouse.
776,You mean the house on Neibolt Street
777,You mean the creepyass house where all the junkies and hobos like to sleep
778,I hate that place.
779,Always feels like it's watching me.
780,That's where I saw IT
781,There I saw a clown.
782,Thathathathat's where IT lives.
783,I can't imagine anything ever wanting to live there.
784,Can we stop talking about this
785,I can barely breathe
786,It's summer.
787,"we're kids, I can barely breathe"
788,having a fucking asthma attack
789,and fuck doing this.
790,What the hell Put the map back
791,What happened
792,What's going on
793,"I don't know, look"
794,guys
795,Georgie.
796,Bill
797,WHAT THE FUCK
798,It's IT
799,WHAT THE FUCK IS THAT
800,I DON'T FUCKING KNOW
801,Turn it off
802,"Yes, Turn it off"
803,"Run, Stanley"
804,What is that
805,What's up
806,"Thanks, Ben."
807,IT saw us
